{
  "id": "c-hedenkamp",
  "name": "C. Hedenkamp",
  "ownerId": "c-hedenkamp-gmbh",
  "ownership": "owned",
  "tier": "none",
  "status": "rated",
  "verdict": "Owned by C. Hedenkamp GmbH & Co. KG. Nothing found.",
  "claimIds": [
    "c-hedenkamp-gmbh-record"
  ],
  "aliases": [],
  "note": "Rating note: Small mittelstand firm; family owners in the register. No state link."
}
