{
  "id": "md-anderson-cancer-center",
  "name": "MD Anderson Cancer Center",
  "ownerId": "university-of-texas-system",
  "ownership": "owned",
  "tier": "unrated",
  "status": "being-rated",
  "verdict": "MD Anderson, the Houston Dynamo front sponsor, is a component institution of the University of Texas System - its own about page states it is part of the UT….",
  "claimIds": [
    "university-of-texas-system-record"
  ],
  "aliases": [],
  "note": "Rating note: ON HOLD: public ownership, but no sourced claim of abuses by that owner, which serious needs."
}
