{
  "id": "alpinestars-c",
  "name": "Alpinestars",
  "ownerId": "alpinestars",
  "ownership": "owned",
  "tier": "none",
  "status": "rated",
  "verdict": "Owned by Alpinestars S.p.A. (Mazzarolo family). Nothing found.",
  "claimIds": [
    "alpinestars-record"
  ],
  "aliases": [],
  "note": "Rating note: Family ownership from the company's own history page; no dated shareholder register published. Same owner as 'alpinestars-h'."
}
