{
  "id": "sardegna-turismo",
  "name": "Sardegna Turismo / Doppio Malto",
  "ownerId": "regione-autonoma-della-sardegna",
  "ownership": "owned",
  "tier": "unrated",
  "status": "being-rated",
  "verdict": "The 'Sardegna' branding on the Cagliari front shirt is the tourism promotion of the Autonomous Region of Sardinia, run by its regional tourism department….",
  "claimIds": [
    "regione-autonoma-della-sardegna-record"
  ],
  "aliases": [],
  "note": "Rating note: Sponsor is a hybrid: regional state tourism body plus private brewery, and Cagliari has rotated sponsors (Banco di Sardegna, Moby). Call is driven by the state-side branding; if the exposure is judged to be Doppio Malto alone the tier would drop to 'none'. ON HOLD: public ownership, but no sourced claim of abuses by that owner, which serious needs."
}
