{
  "id": "tommy-hilfiger",
  "name": "Tommy Hilfiger",
  "ownerId": "pvh-corp",
  "ownership": "owned",
  "tier": "none",
  "status": "rated",
  "verdict": "Owned by PVH Corp.. Nothing found.",
  "claimIds": [
    "pvh-corp-record"
  ],
  "aliases": [],
  "note": "Rating note: PVH also owns Calvin Klein. No sovereign stake."
}
